{
    "name": "InsuranceExternalDataFeeds",
    "desc": "External data feeds schema for third-party data integration. Includes credit bureau reports, motor vehicle records, market data, weather, demographics, regulatory information, and compliance screening data. Provides 27 feed tables organized across 6 business domains.",
    "tables": [
        {
            "name": "EXT_CREDIT_BUREAU_TRW",
            "type": "BASE TABLE",
            "comment": "TRW credit bureau data \u2014 credit score, payment history, accounts",
            "columns": [
                {
                    "name": "FEED_ID",
                    "type": "VARCHAR(100)",
                    "nullable": false,
                    "comment": "Unique feed record identifier"
                },
                {
                    "name": "FEED_DATE",
                    "type": "DATE",
                    "nullable": false,
                    "comment": "Date data received from feed"
                },
                {
                    "name": "INDIVIDUAL_ID",
                    "type": "VARCHAR(100)",
                    "nullable": false,
                    "comment": "Individual identifier from bureau"
                },
                {
                    "name": "CREDIT_SCORE",
                    "type": "INTEGER",
                    "nullable": true
                },
                {
                    "name": "CREDIT_SCORE_REASON",
                    "type": "VARCHAR(255)",
                    "nullable": true
                },
                {
                    "name": "ACCOUNTS_TOTAL",
                    "type": "INTEGER",
                    "nullable": true
                },
                {
                    "name": "ACCOUNTS_ACTIVE",
                    "type": "INTEGER",
                    "nullable": true
                },
                {
                    "name": "ACCOUNTS_DELINQUENT",
                    "type": "INTEGER",
                    "nullable": true
                },
                {
                    "name": "REVOLVING_BALANCE",
                    "type": "DECIMAL(18,2)",
                    "nullable": true
                },
                {
                    "name": "REVOLVING_LIMIT",
                    "type": "DECIMAL(18,2)",
                    "nullable": true
                },
                {
                    "name": "INSTALLMENT_BALANCE",
                    "type": "DECIMAL(18,2)",
                    "nullable": true
                },
                {
                    "name": "MORTGAGE_BALANCE",
                    "type": "DECIMAL(18,2)",
                    "nullable": true
                },
                {
                    "name": "INQUIRIES_LAST_6M",
                    "type": "INTEGER",
                    "nullable": true
                },
                {
                    "name": "PUBLIC_RECORDS",
                    "type": "INTEGER",
                    "nullable": true
                },
                {
                    "name": "BANKRUPTCIES",
                    "type": "INTEGER",
                    "nullable": true
                },
                {
                    "name": "COLLECTIONS",
                    "type": "INTEGER",
                    "nullable": true
                },
                {
                    "name": "LOAD_DTS",
                    "type": "TIMESTAMP",
                    "nullable": false
                },
                {
                    "name": "LOAD_SOURCE",
                    "type": "VARCHAR(100)",
                    "nullable": false
                }
            ],
            "constraints": [
                {
                    "name": "PK__EXT_CREDIT_BUREAU_TRW",
                    "type": "PRIMARY KEY",
                    "def": "PRIMARY KEY (FEED_ID)",
                    "table": "EXT_CREDIT_BUREAU_TRW",
                    "columns": [
                        "FEED_ID"
                    ]
                }
            ]
        },
        {
            "name": "EXT_CREDIT_BUREAU_EQUIFAX",
            "type": "BASE TABLE",
            "comment": "Equifax credit bureau data",
            "columns": [
                {
                    "name": "FEED_ID",
                    "type": "VARCHAR(100)",
                    "nullable": false
                },
                {
                    "name": "FEED_DATE",
                    "type": "DATE",
                    "nullable": false
                },
                {
                    "name": "INDIVIDUAL_ID",
                    "type": "VARCHAR(100)",
                    "nullable": false
                },
                {
                    "name": "CREDIT_SCORE",
                    "type": "INTEGER",
                    "nullable": true
                },
                {
                    "name": "CREDIT_SCORE_RANGE",
                    "type": "VARCHAR(50)",
                    "nullable": true
                },
                {
                    "name": "FILE_VARIATIONS",
                    "type": "INTEGER",
                    "nullable": true
                },
                {
                    "name": "CREDIT_ALERT_FLAGS",
                    "type": "VARCHAR(255)",
                    "nullable": true
                },
                {
                    "name": "MAX_DELINQUENCY",
                    "type": "INTEGER",
                    "nullable": true
                },
                {
                    "name": "RECENT_INQUIRIES",
                    "type": "INTEGER",
                    "nullable": true
                },
                {
                    "name": "ACCOUNTS_STATUS",
                    "type": "VARCHAR(255)",
                    "nullable": true
                },
                {
                    "name": "ACCOUNT_PAYMENT_HISTORY",
                    "type": "VARCHAR(255)",
                    "nullable": true
                },
                {
                    "name": "DEROGATORY_ITEMS",
                    "type": "TEXT",
                    "nullable": true
                },
                {
                    "name": "LOAD_DTS",
                    "type": "TIMESTAMP",
                    "nullable": false
                },
                {
                    "name": "LOAD_SOURCE",
                    "type": "VARCHAR(100)",
                    "nullable": false
                }
            ],
            "constraints": [
                {
                    "name": "PK__EXT_CREDIT_BUREAU_EQUIFAX",
                    "type": "PRIMARY KEY",
                    "def": "PRIMARY KEY (FEED_ID)",
                    "table": "EXT_CREDIT_BUREAU_EQUIFAX",
                    "columns": [
                        "FEED_ID"
                    ]
                }
            ]
        },
        {
            "name": "EXT_CREDIT_BUREAU_EXPERIAN",
            "type": "BASE TABLE",
            "comment": "Experian credit bureau data",
            "columns": [
                {
                    "name": "FEED_ID",
                    "type": "VARCHAR(100)",
                    "nullable": false
                },
                {
                    "name": "FEED_DATE",
                    "type": "DATE",
                    "nullable": false
                },
                {
                    "name": "INDIVIDUAL_ID",
                    "type": "VARCHAR(100)",
                    "nullable": false
                },
                {
                    "name": "FICO_SCORE",
                    "type": "INTEGER",
                    "nullable": true
                },
                {
                    "name": "SCORE_MODEL",
                    "type": "VARCHAR(50)",
                    "nullable": true
                },
                {
                    "name": "ACCOUNTS_OPEN",
                    "type": "INTEGER",
                    "nullable": true
                },
                {
                    "name": "ACCOUNTS_CLOSED",
                    "type": "INTEGER",
                    "nullable": true
                },
                {
                    "name": "BALANCE_TOTAL",
                    "type": "DECIMAL(18,2)",
                    "nullable": true
                },
                {
                    "name": "MONTHS_SINCE_LAST_INQUIRY",
                    "type": "INTEGER",
                    "nullable": true
                },
                {
                    "name": "AVERAGE_ACCOUNT_AGE",
                    "type": "INTEGER",
                    "nullable": true
                },
                {
                    "name": "OLDEST_TRADE_LINE_AGE",
                    "type": "INTEGER",
                    "nullable": true
                },
                {
                    "name": "RISK_INDICATORS",
                    "type": "TEXT",
                    "nullable": true
                },
                {
                    "name": "LOAD_DTS",
                    "type": "TIMESTAMP",
                    "nullable": false
                },
                {
                    "name": "LOAD_SOURCE",
                    "type": "VARCHAR(100)",
                    "nullable": false
                }
            ],
            "constraints": [
                {
                    "name": "PK__EXT_CREDIT_BUREAU_EXPERIAN",
                    "type": "PRIMARY KEY",
                    "def": "PRIMARY KEY (FEED_ID)",
                    "table": "EXT_CREDIT_BUREAU_EXPERIAN",
                    "columns": [
                        "FEED_ID"
                    ]
                }
            ]